{
  "slug": "anfiteatro-baron-lui-mongo-centro-cultural-deportivo-y-comunitario",
  "type": "venue",
  "name": "Anfiteatro Barón Lui Mongo Centro Cultural Deportivo y Comunitario",
  "short_name": null,
  "venue_type": "centro-cultural",
  "owner": null,
  "place": {
    "name": null,
    "address": null,
    "commune": "valparaiso",
    "lat": null,
    "lng": null,
    "precision": "commune_centroid",
    "geocode_source": null,
    "geocoded_at": null
  },
  "capacity": null,
  "rooms": [],
  "website": null,
  "contact_public": null,
  "social": {
    "instagram": null,
    "facebook": null,
    "tiktok": null,
    "youtube": null
  },
  "disciplines": [],
  "accessibility": [],
  "program_url": null,
  "status": "desconocido",
  "description_md": null,
  "media": [],
  "sources": [
    {
      "url": "https://puntos.cultura.gob.cl/valparaiso/",
      "title": "Puntos de Cultura Validados Región de Valparaíso",
      "publisher": "Ministerio de las Culturas, las Artes y el Patrimonio — Programa Puntos de Cultura Comunitaria",
      "type": "institucional",
      "level": 1,
      "role": "primaria",
      "accessed_at": "2026-09-08",
      "archived_url": null,
      "supports": [],
      "notes": "Listado de 87 organizaciones por comuna. La página no describe el ámbito de la mayoría; solo el nombre permite inferirlo, por lo que los ámbitos quedan como 'por confirmar' salvo que el nombre lo diga."
    },
    {
      "url": "https://www.fondosdecultura.cl/wp-content/uploads/2024/03/Seleccionados-FN-2024-2DA.pdf",
      "title": "Seleccionados Fondart Nacional 2024 — Creación artística e Infraestructura cultural (marzo 2024)",
      "publisher": "Ministerio de las Culturas, las Artes y el Patrimonio — Fondos Cultura",
      "type": "institucional",
      "level": 1,
      "role": "secundaria",
      "accessed_at": "2026-09-08",
      "archived_url": null,
      "supports": [],
      "notes": null
    }
  ],
  "verification": {
    "status": "pendiente",
    "confidence_score": 60,
    "verified_at": null,
    "verified_by": null,
    "next_review_at": null,
    "note": "Importado del catastro regional del ecosistema teatral (Fase 1: descubrimiento); pendiente de verificación editorial."
  },
  "published": false
}
