{
  "slug": "dispositivo-cultural",
  "type": "venue",
  "name": "Dispositivo Cultural",
  "short_name": null,
  "venue_type": "espacio-independiente",
  "owner": null,
  "place": {
    "name": null,
    "address": null,
    "commune": "valparaiso",
    "lat": null,
    "lng": null,
    "precision": "commune_centroid",
    "geocode_source": null,
    "geocoded_at": null
  },
  "capacity": null,
  "rooms": [],
  "website": null,
  "contact_public": null,
  "social": {
    "instagram": null,
    "facebook": null,
    "tiktok": null,
    "youtube": null
  },
  "disciplines": [],
  "accessibility": [],
  "program_url": null,
  "status": "desconocido",
  "description_md": null,
  "media": [],
  "sources": [
    {
      "url": "https://www.cultura.gob.cl/convocatorias/18-espacios-culturales-de-la-region-de-valparaiso-obtienen-recursos-para-su-funcionamiento/",
      "title": "18 espacios culturales de la Región de Valparaíso obtienen recursos para su funcionamiento",
      "publisher": "Ministerio de las Culturas, las Artes y el Patrimonio",
      "type": "institucional",
      "level": 1,
      "role": "primaria",
      "accessed_at": "2026-09-08",
      "archived_url": null,
      "supports": [],
      "notes": "Nota del 12 de agosto de 2020. PAOCC 2020, 18 beneficiarios con montos; total regional $290.264.670."
    }
  ],
  "verification": {
    "status": "pendiente",
    "confidence_score": 60,
    "verified_at": null,
    "verified_by": null,
    "next_review_at": null,
    "note": "Importado del catastro regional del ecosistema teatral (Fase 1: descubrimiento); pendiente de verificación editorial."
  },
  "published": false
}
