{
  "slug": "galpon-del-parque-municipal-de-putaendo",
  "type": "venue",
  "name": "Galpón del Parque Municipal de Putaendo",
  "short_name": null,
  "venue_type": "no-convencional",
  "owner": "municipal",
  "place": {
    "name": null,
    "address": null,
    "commune": "putaendo",
    "lat": null,
    "lng": null,
    "precision": "commune_centroid",
    "geocode_source": null,
    "geocoded_at": null
  },
  "capacity": null,
  "rooms": [],
  "website": null,
  "contact_public": null,
  "social": {
    "instagram": null,
    "facebook": null,
    "tiktok": null,
    "youtube": null
  },
  "disciplines": [],
  "accessibility": [],
  "program_url": null,
  "status": "desconocido",
  "description_md": null,
  "media": [],
  "sources": [
    {
      "url": "https://eltrabajo.cl/web/primera-edicion-del-festival-escolar-de-teatro-se-realizo-con-exito-en-putaendo/",
      "title": "Primera edición del Festival Escolar de Teatro se realizó con éxito en Putaendo",
      "publisher": "Diario El Trabajo (San Felipe)",
      "type": "prensa",
      "level": 2,
      "role": "primaria",
      "accessed_at": "2026-09-08",
      "archived_url": null,
      "supports": [],
      "notes": "Nota del 29 de agosto de 2024."
    }
  ],
  "verification": {
    "status": "pendiente",
    "confidence_score": 60,
    "verified_at": null,
    "verified_by": null,
    "next_review_at": null,
    "note": "Importado del catastro regional del ecosistema teatral (Fase 1: descubrimiento); pendiente de verificación editorial."
  },
  "published": false
}
