{
  "slug": "sala-de-artes-escenicas-universidad-de-playa-ancha",
  "type": "venue",
  "name": "Sala de Artes Escénicas Universidad de Playa Ancha",
  "short_name": "Sala UPLA",
  "venue_type": "escuela",
  "owner": "universitario",
  "place": {
    "name": null,
    "address": null,
    "commune": "valparaiso",
    "lat": null,
    "lng": null,
    "precision": "commune_centroid",
    "geocode_source": null,
    "geocoded_at": null
  },
  "capacity": null,
  "rooms": [],
  "website": null,
  "contact_public": null,
  "social": {
    "instagram": null,
    "facebook": null,
    "tiktok": null,
    "youtube": null
  },
  "disciplines": [],
  "accessibility": [],
  "program_url": null,
  "status": "desconocido",
  "description_md": null,
  "media": [],
  "sources": [
    {
      "url": "https://www.cultura.gob.cl/eventos-actividades/mas-de-60-actividades-artisticas-gratuitas-ofrecera-la-red-de-espacios-culturales-de-la-region-de-valparaiso/",
      "title": "Más de 60 actividades artísticas gratuitas ofrecerá la Red de Espacios Culturales de la Región de Valparaíso",
      "publisher": "Ministerio de las Culturas, las Artes y el Patrimonio",
      "type": "institucional",
      "level": 1,
      "role": "primaria",
      "accessed_at": "2026-09-08",
      "archived_url": null,
      "supports": [],
      "notes": "Nota del 7 de octubre de 2020. Lista los 27 espacios de la Red de Espacios Culturales regional y actividades entre octubre de 2020 y marzo de 2021 sin fechas exactas."
    },
    {
      "url": "https://valpocultura.cl/eventos/categoria/teatro/",
      "title": "Eventos › Teatro — Valpocultura",
      "publisher": "Valpocultura",
      "type": "directorio",
      "level": 3,
      "role": "secundaria",
      "accessed_at": "2026-09-08",
      "archived_url": null,
      "supports": [],
      "notes": "Agenda cultural agregadora; consultada en septiembre de 2026 (35 eventos, la mayoría entradas de la cartelera de la Sala Negra UV)."
    },
    {
      "url": "https://teatroamil.cl/articulos/festival-sintesis-teatral-valparaiso-2019/",
      "title": "Festival Síntesis encabeza celebración del Día Nacional del Teatro en Valparaíso",
      "publisher": "Fundación Teatro a Mil",
      "type": "prensa",
      "level": 2,
      "role": "secundaria",
      "accessed_at": "2026-09-08",
      "archived_url": null,
      "supports": [],
      "notes": "Cuarta versión (2019): 6 al 26 de mayo, 23 obras, 5 estrenos, más de 30 presentaciones en 8 espacios; extensión a San Antonio, Quillota, Quilpué, San Felipe y Olmué."
    },
    {
      "url": "https://parquecultural.cl/2019/05/03/festival-sintesis-teatral-valparaiso-encabeza-celebracion-del-mes-del-teatro/",
      "title": "Festival Síntesis Teatral Valparaíso encabeza celebración del mes del teatro",
      "publisher": "Parque Cultural de Valparaíso",
      "type": "institucional",
      "level": 1,
      "role": "secundaria",
      "accessed_at": "2026-09-08",
      "archived_url": null,
      "supports": [],
      "notes": "Nota del 3 de mayo de 2019; organiza Laboratorio Anatomía Teatral (dir. Claudio Rodríguez); programa completo en laboratorioanatomiateatral.cl/folleto-fstv19."
    },
    {
      "url": "https://parquecultural.cl/2020/05/10/festival-sintesis-teatral-valparaiso-adapta-su-programacion-y-formato-para-celebrar-primera-version-via-streaming/",
      "title": "Festival Síntesis Teatral Valparaíso adapta su programación y formato para celebrar primera versión vía streaming",
      "publisher": "Parque Cultural de Valparaíso",
      "type": "institucional",
      "level": 1,
      "role": "secundaria",
      "accessed_at": "2026-09-08",
      "archived_url": null,
      "supports": [],
      "notes": "Quinta versión (mayo de 2020) por streaming, producida por Parque Cultural, Centex y Laboratorio Anatomía Teatral (según resumen del buscador)."
    }
  ],
  "verification": {
    "status": "pendiente",
    "confidence_score": 60,
    "verified_at": null,
    "verified_by": null,
    "next_review_at": null,
    "note": "Importado del catastro regional del ecosistema teatral (Fase 1: descubrimiento); pendiente de verificación editorial."
  },
  "published": false
}
