{
  "slug": "centex-centro-de-extension-del-ministerio-de-las-culturas",
  "type": "venue",
  "name": "Centex — Centro de Extensión del Ministerio de las Culturas",
  "short_name": "CENTEX",
  "venue_type": "centro-cultural",
  "owner": "público (Ministerio de las Culturas, las Artes y el Patrimonio)",
  "place": {
    "name": null,
    "address": null,
    "commune": "valparaiso",
    "lat": null,
    "lng": null,
    "precision": "commune_centroid",
    "geocode_source": null,
    "geocoded_at": null
  },
  "capacity": null,
  "rooms": [],
  "website": null,
  "contact_public": null,
  "social": {
    "instagram": null,
    "facebook": null,
    "tiktok": null,
    "youtube": null
  },
  "disciplines": [],
  "accessibility": [],
  "program_url": null,
  "status": "desconocido",
  "description_md": null,
  "media": [],
  "sources": [
    {
      "url": "https://centex.cultura.gob.cl/con-ocho-montajes-en-ocho-espacios-distintos-valparaiso-celebra-mes-del-teatro/",
      "title": "Ciudad Teatro: con ocho montajes en ocho espacios distintos Valparaíso celebra el Mes del Teatro",
      "publisher": "Centex — Centro de Extensión del Ministerio de las Culturas, las Artes y el Patrimonio",
      "type": "institucional",
      "level": 1,
      "role": "primaria",
      "accessed_at": "2026-09-08",
      "archived_url": null,
      "supports": [],
      "notes": "Nota de 2025 con programa completo: 8 funciones entre el 5 y el 11 de mayo de 2025 en Valparaíso. Gratuidad no especificada."
    },
    {
      "url": "https://centex.cultura.gob.cl/evento/ciudad-teatro/",
      "title": "Ciudad Teatro — Centex",
      "publisher": "Centex — Ministerio de las Culturas, las Artes y el Patrimonio",
      "type": "institucional",
      "level": 1,
      "role": "secundaria",
      "accessed_at": "2026-09-08",
      "archived_url": null,
      "supports": [],
      "notes": null
    },
    {
      "url": "https://www.cultura.gob.cl/eventos-actividades/mes-del-teatro-se-conmemorara-con-nuevos-estrenos-teatro-familiar-y-obras-inclusivas/",
      "title": "Mes del Teatro se conmemorará con nuevos estrenos, teatro familiar y obras inclusivas",
      "publisher": "Ministerio de las Culturas, las Artes y el Patrimonio",
      "type": "institucional",
      "level": 1,
      "role": "secundaria",
      "accessed_at": "2026-09-08",
      "archived_url": null,
      "supports": [],
      "notes": "Nota del 10 de mayo de 2022 con la programación regional del Mes del Teatro (11 al 28 de mayo de 2022)."
    },
    {
      "url": "https://teatroamil.cl/articulos/festival-sintesis-teatral-valparaiso-2019/",
      "title": "Festival Síntesis encabeza celebración del Día Nacional del Teatro en Valparaíso",
      "publisher": "Fundación Teatro a Mil",
      "type": "prensa",
      "level": 2,
      "role": "secundaria",
      "accessed_at": "2026-09-08",
      "archived_url": null,
      "supports": [],
      "notes": "Cuarta versión (2019): 6 al 26 de mayo, 23 obras, 5 estrenos, más de 30 presentaciones en 8 espacios; extensión a San Antonio, Quillota, Quilpué, San Felipe y Olmué."
    },
    {
      "url": "https://parquecultural.cl/2019/05/03/festival-sintesis-teatral-valparaiso-encabeza-celebracion-del-mes-del-teatro/",
      "title": "Festival Síntesis Teatral Valparaíso encabeza celebración del mes del teatro",
      "publisher": "Parque Cultural de Valparaíso",
      "type": "institucional",
      "level": 1,
      "role": "secundaria",
      "accessed_at": "2026-09-08",
      "archived_url": null,
      "supports": [],
      "notes": "Nota del 3 de mayo de 2019; organiza Laboratorio Anatomía Teatral (dir. Claudio Rodríguez); programa completo en laboratorioanatomiateatral.cl/folleto-fstv19."
    },
    {
      "url": "https://parquecultural.cl/2020/05/10/festival-sintesis-teatral-valparaiso-adapta-su-programacion-y-formato-para-celebrar-primera-version-via-streaming/",
      "title": "Festival Síntesis Teatral Valparaíso adapta su programación y formato para celebrar primera versión vía streaming",
      "publisher": "Parque Cultural de Valparaíso",
      "type": "institucional",
      "level": 1,
      "role": "secundaria",
      "accessed_at": "2026-09-08",
      "archived_url": null,
      "supports": [],
      "notes": "Quinta versión (mayo de 2020) por streaming, producida por Parque Cultural, Centex y Laboratorio Anatomía Teatral (según resumen del buscador)."
    }
  ],
  "verification": {
    "status": "pendiente",
    "confidence_score": 60,
    "verified_at": null,
    "verified_by": null,
    "next_review_at": null,
    "note": "Importado del catastro regional del ecosistema teatral (Fase 1: descubrimiento); pendiente de verificación editorial."
  },
  "published": false
}
