{
  "slug": "centro-cultural-de-la-calera",
  "type": "venue",
  "name": "Centro Cultural de La Calera",
  "short_name": null,
  "venue_type": "centro-cultural",
  "owner": null,
  "place": {
    "name": null,
    "address": "Av. Latorre 180, La Calera",
    "commune": "la-calera",
    "lat": null,
    "lng": null,
    "precision": "commune_centroid",
    "geocode_source": null,
    "geocoded_at": null
  },
  "capacity": null,
  "rooms": [],
  "website": null,
  "contact_public": null,
  "social": {
    "instagram": null,
    "facebook": null,
    "tiktok": null,
    "youtube": null
  },
  "disciplines": [],
  "accessibility": [],
  "program_url": null,
  "status": "desconocido",
  "description_md": null,
  "media": [],
  "sources": [
    {
      "url": "https://g5noticias.cl/2026/09/04/puntos-de-fuga-llega-este-sabado-a-la-calera-con-musica-teatro-y-folclor-de-tres-comunas/",
      "title": "Puntos de Fuga llega este sábado a La Calera con música, teatro y folclor de tres comunas",
      "publisher": "G5noticias",
      "type": "prensa",
      "level": 2,
      "role": "primaria",
      "accessed_at": "2026-09-08",
      "archived_url": null,
      "supports": [],
      "notes": "Nota del 4 de septiembre de 2026. 'Trenzando Puntos de Fuga' es una iniciativa de la Red Ramal Cultural articulada con la Seremi de las Culturas y las municipalidades; 2025 primera etapa, 2026 segunda con 12 comunas: Quintero, Concón, Zapallar, Olmué, La Calera, Quillota, Papudo, Petorca, Cabildo, Puchuncaví, La Cruz y Limache."
    }
  ],
  "verification": {
    "status": "pendiente",
    "confidence_score": 60,
    "verified_at": null,
    "verified_by": null,
    "next_review_at": null,
    "note": "Importado del catastro regional del ecosistema teatral (Fase 1: descubrimiento); pendiente de verificación editorial."
  },
  "published": false
}
