{
  "slug": "casino-de-funcionarios-de-la-biblioteca-municipal-de-quintero",
  "type": "venue",
  "name": "Casino de funcionarios de la Biblioteca Municipal de Quintero",
  "short_name": null,
  "venue_type": "no-convencional",
  "owner": "municipal",
  "place": {
    "name": null,
    "address": null,
    "commune": "quintero",
    "lat": null,
    "lng": null,
    "precision": "commune_centroid",
    "geocode_source": null,
    "geocoded_at": null
  },
  "capacity": null,
  "rooms": [],
  "website": null,
  "contact_public": null,
  "social": {
    "instagram": null,
    "facebook": null,
    "tiktok": null,
    "youtube": null
  },
  "disciplines": [],
  "accessibility": [],
  "program_url": null,
  "status": "desconocido",
  "description_md": null,
  "media": [],
  "sources": [
    {
      "url": "https://diariolaquinta.cl/2025/07/29/cultura-terrapolis-obra-que-aborda-la-crisis-medioambiental-de-quintero-y-puchuncavi-vuelve-a-la-region-de-valparaiso/",
      "title": "'Terrapolis': Obra que aborda la crisis medioambiental de Quintero y Puchuncaví vuelve a la Región de Valparaíso",
      "publisher": "Diario La Quinta",
      "type": "prensa",
      "level": 2,
      "role": "primaria",
      "accessed_at": "2026-09-08",
      "archived_url": null,
      "supports": [],
      "notes": "Nota del 29 de julio de 2025 con gira regional de agosto de 2025."
    }
  ],
  "verification": {
    "status": "pendiente",
    "confidence_score": 60,
    "verified_at": null,
    "verified_by": null,
    "next_review_at": null,
    "note": "Importado del catastro regional del ecosistema teatral (Fase 1: descubrimiento); pendiente de verificación editorial."
  },
  "published": false
}
