{
  "slug": "junta-de-vecinos-san-juan-de-llolleo",
  "type": "venue",
  "name": "Junta de Vecinos San Juan de Llolleo",
  "short_name": null,
  "venue_type": "no-convencional",
  "owner": "comunitario",
  "place": {
    "name": null,
    "address": null,
    "commune": "san-antonio",
    "lat": null,
    "lng": null,
    "precision": "commune_centroid",
    "geocode_source": null,
    "geocoded_at": null
  },
  "capacity": null,
  "rooms": [],
  "website": null,
  "contact_public": null,
  "social": {
    "instagram": null,
    "facebook": null,
    "tiktok": null,
    "youtube": null
  },
  "disciplines": [],
  "accessibility": [],
  "program_url": null,
  "status": "desconocido",
  "description_md": null,
  "media": [],
  "sources": [
    {
      "url": "https://centrocultural.sanantonio.cl/index.php/item/3077-destacadas-obras-trae-a-san-antonio-el-festival-litoral-teatral-2026",
      "title": "Destacadas obras trae a San Antonio el Festival Litoral Teatral 2026",
      "publisher": "Centro Cultural San Antonio",
      "type": "oficial",
      "level": 1,
      "role": "primaria",
      "accessed_at": "2026-09-05",
      "archived_url": null,
      "supports": [],
      "notes": "Confirma 13 compañías, 12 espectáculos y las funciones del 19, 25 y 26 de abril de 2026."
    },
    {
      "url": "https://centrocultural.sanantonio.cl/index.php/item/2966-festival-de-teatro-litoral-teatral-2024",
      "title": "Festival de Teatro Litoral Teatral 2024",
      "publisher": "Centro Cultural San Antonio",
      "type": "oficial",
      "level": 1,
      "role": "secundaria",
      "accessed_at": "2026-09-08",
      "archived_url": null,
      "supports": [],
      "notes": "Festival del 10 al 21 de enero de 2024; actividades al aire libre gratuitas, funciones en sala con reserva; las fechas por obra no aparecen en la nota."
    }
  ],
  "verification": {
    "status": "pendiente",
    "confidence_score": 60,
    "verified_at": null,
    "verified_by": null,
    "next_review_at": null,
    "note": "Importado del catastro regional del ecosistema teatral (Fase 1: descubrimiento); pendiente de verificación editorial."
  },
  "published": false
}
